{
  "schema_version": "1.0.0",
  "job_id": "tomtom.demo-004",
  "source": "tomtom",
  "source_job_id": "demo-004",
  "canonical_url": "https://careers.tomtom.com/job/demo-004",
  "title": "Backend Engineer - Navigation Services",
  "company": "TomTom",
  "location": "Amsterdam",
  "employment_type": "CDI",
  "remote": "Partial",
  "salary": "70k-95k EUR",
  "description": "TomTom Navigation Services team is hiring a Backend Engineer. You will build high-performance APIs for real-time routing and traffic services using Go, Python, Kubernetes, and PostgreSQL. Experience with distributed systems, gRPC, and cloud-native architectures required. 5+ years experience. You will work on systems serving millions of users daily with sub-100ms latency requirements.",
  "published_at": "2026-09-28T11:00:00Z",
  "discovered_at": "2026-10-10T12:00:00Z",
  "first_seen_at": "2026-10-10T12:00:00Z",
  "last_seen_at": "2026-10-10T12:00:00Z",
  "content_hash": "ffb85c645afaa3f7aa1abaa612ce702ba6fbf9e33fdf33656cf89f50e8fe8689",
  "status": "active",
  "normalization_warnings": [],
  "analysis": {
    "hard_filter": {
      "passed": true,
      "reasons": [],
      "missing_skills": []
    },
    "screening": null,
    "ranking": {
      "final_score": 83.0,
      "thinking_trace": "Strong backend/distributed systems match (Go, Python, K8s, PostgreSQL), location bonus (Amsterdam), no domain screening in global mode.",
      "kernel_version": "1.0"
    }
  }
}
