{
  "schema_version": "1.0.0",
  "job_id": "tomtom.job-12345",
  "source": "tomtom",
  "source_job_id": "job-12345",
  "canonical_url": "https://careers.tomtom.com/job/job-12345",
  "title": "Backend Engineer - Maps Platform",
  "company": "TomTom",
  "location": "Amsterdam",
  "employment_type": "CDI",
  "remote": "Yes",
  "salary": "65k-85k EUR",
  "description": "TomTom Maps Platform team is hiring a Backend Engineer. You will build high-performance APIs for mapping and location services using Go, Python, Kubernetes, and PostgreSQL. Experience with distributed systems, gRPC, and cloud-native architectures required. 4+ years experience.",
  "published_at": "2026-10-03T11:00:00Z",
  "discovered_at": "2026-10-10T12:00:00Z",
  "first_seen_at": "2026-10-10T12:00:00Z",
  "last_seen_at": "2026-10-10T12:00:00Z",
  "content_hash": "1329c29bdccb5b5d1cfeaab07814369c03e960700692ce29941f3cb0e3c69b64",
  "status": "active",
  "normalization_warnings": [],
  "analysis": {
    "hard_filter": {
      "passed": true,
      "reasons": [],
      "missing_skills": []
    },
    "screening": null,
    "ranking": {
      "final_score": 72.0,
      "thinking_trace": "Good tech match (Python, K8s, PostgreSQL, distributed systems), location bonus (Amsterdam/Remote), no domain screening in global mode.",
      "kernel_version": "1.0"
    }
  }
}